{
  "schemaVersion": "1.0.0",
  "status": "PLANNED",
  "governing": false,
  "environment": "development",
  "phase": "prepare_authenticated_evidence",
  "materializationAuthorized": false,
  "sourceReadinessPacket": {
    "path": "deployment/development-activation-readiness-packet.json",
    "sha256": "dfdbd7c59f14dc07eb4f07cd185023626230501688dec37e9b7d65605ce84e8a",
    "pr55MergeCommit": "44c08d6673cf095a767dba5a1a10f4c82a7b34e4"
  },
  "target": {
    "reviewedCommit": null,
    "requiresFinalReviewedRuntimeWiringCommit": true,
    "activationPlanPath": "deployment/development-activation-plan-schema-reconciled.json",
    "activationPlanSha256": "7191626c099ee5fba00cfcd76091e090139a9eeac1ff7ae5d7a6344048912b9e"
  },
  "roles": {
    "maker": {
      "principalId": null,
      "keyId": null,
      "purposes": [
        "maker_validation",
        "backup_evidence"
      ],
      "samePrincipalRequired": true
    },
    "checker": {
      "principalId": null,
      "keyId": null,
      "purposes": [
        "checker_validation",
        "rollback_evidence"
      ],
      "samePrincipalRequired": true
    },
    "owner": {
      "principalId": null,
      "keyId": null,
      "purposes": [
        "resource_activation_authorization",
        "worker_deployment_authorization"
      ],
      "samePrincipalRequired": true,
      "distinctDecisionIdsRequired": true
    },
    "pairwiseDistinctPrincipalsRequired": true
  },
  "materials": [
    {
      "id": "maker_validation_attestation",
      "role": "maker",
      "purpose": "maker_validation",
      "kind": "identity_attestation",
      "status": "PENDING",
      "actionDigest": null,
      "evidenceDigest": null,
      "signedMaterial": null
    },
    {
      "id": "checker_validation_attestation",
      "role": "checker",
      "purpose": "checker_validation",
      "kind": "identity_attestation",
      "status": "PENDING",
      "actionDigest": null,
      "evidenceDigest": null,
      "signedMaterial": null
    },
    {
      "id": "rollback_attestation",
      "role": "checker",
      "purpose": "rollback_evidence",
      "kind": "identity_attestation",
      "status": "PENDING",
      "actionDigest": null,
      "evidenceDigest": null,
      "signedMaterial": null
    },
    {
      "id": "backup_attestation",
      "role": "maker",
      "purpose": "backup_evidence",
      "kind": "identity_attestation",
      "status": "PENDING",
      "actionDigest": null,
      "evidenceDigest": null,
      "signedMaterial": null
    },
    {
      "id": "resource_activation_decision",
      "role": "owner",
      "purpose": "resource_activation_authorization",
      "kind": "owner_decision",
      "status": "PENDING",
      "actionDigest": null,
      "evidenceDigest": null,
      "signedMaterial": null
    },
    {
      "id": "worker_deployment_decision",
      "role": "owner",
      "purpose": "worker_deployment_authorization",
      "kind": "owner_decision",
      "status": "PENDING",
      "actionDigest": null,
      "evidenceDigest": null,
      "signedMaterial": null
    }
  ],
  "storageBoundary": {
    "publicIdentityAndOwnerKeysMayBeStoredInAuthorityD1": true,
    "privateKeysMayBeStoredInRepository": false,
    "privateKeysMayBeStoredInD1": false,
    "privateKeysRequireManagedSecrets": true,
    "credentialValuesMayAppearInLogsOrArtifacts": false,
    "authorityD1WriteDeferred": true,
    "managedSecretInstallationDeferred": true
  },
  "stopConditions": [
    "the final reviewed runtime-wiring commit is unavailable or changes",
    "maker checker and owner principals are not pairwise distinct",
    "the maker or checker role-continuity requirement cannot be satisfied",
    "the two owner decisions do not use distinct decision IDs",
    "a public-key record or signed material does not bind the exact role purpose and reviewed commit",
    "a private key credential or token would enter repository D1 logs or artifacts",
    "any signing verification storage or result state is ambiguous incomplete or inconsistent"
  ],
  "prohibitedOperations": [
    "generate_or_install_key",
    "sign_attestation_or_owner_decision",
    "write_authority_or_activation_evidence",
    "install_or_rotate_secret",
    "modify_binding_or_wrangler_configuration",
    "create_or_trigger_workflow",
    "publish_queue_message",
    "deploy_or_activate_worker",
    "delete_cleanup_retry_or_restore",
    "production_or_customer_operation"
  ],
  "partialFailurePolicy": {
    "automaticDeletion": false,
    "automaticCleanup": false,
    "automaticRetry": false,
    "automaticRestore": false,
    "action": "stop_and_report_exact_state"
  }
}
